{
  "$schema":"https://json-schema.org/draft/2020-12/schema","$id":"h4l-mass-off-registration-v2","type":"object","additionalProperties":false,
  "required":["schema_version","family_id","candidate_definition_digest","original_definition_digest","evaluation_definition_digest","source_registration_path","source_registration_id","prepared_artifact_id","population_id","protocol_sha256","candidate_keys","pairing_contract","blocks","budgets","source_history","qualification","registration_status","assessment_payload_read","registration_id"],
  "properties":{"schema_version":{"const":"h4l-mass-off-registration-v2"},"family_id":{"const":"engineered19_raw_T1_m4l_off_attribution_v1"},"candidate_definition_digest":{"$ref":"#/$defs/digest"},"original_definition_digest":{"$ref":"#/$defs/digest"},"evaluation_definition_digest":{"$ref":"#/$defs/digest"},"source_registration_path":{"type":"string","minLength":1},"source_registration_id":{"$ref":"#/$defs/digest"},"prepared_artifact_id":{"$ref":"#/$defs/digest"},"population_id":{"type":"string","minLength":1},"protocol_sha256":{"$ref":"#/$defs/digest"},"candidate_keys":{"$ref":"#/$defs/candidates"},"pairing_contract":{"$ref":"#/$defs/contract"},"blocks":{"$ref":"#/$defs/blocks"},"budgets":{"$ref":"#/$defs/budgets"},"source_history":{"type":"array"},"qualification":{"type":"object"},"registration_status":{"const":"exploratory_v2"},"assessment_payload_read":{"const":false},"registration_id":{"$ref":"#/$defs/digest"}},
  "$defs":{"digest":{"type":"string","pattern":"^[0-9a-f]{64}$"},"candidates":{"type":"array","minItems":80,"maxItems":80,"uniqueItems":true,"items":{"type":"string","pattern":"^(M0off|M3):"}},"block":{"type":"object","additionalProperties":false,"required":["seed","candidate_keys","block_id","pairing_contract_digest"],"properties":{"seed":{"enum":[42,43,44,45,46]},"candidate_keys":{"type":"array","minItems":16,"maxItems":16,"uniqueItems":true,"items":{"type":"string"}},"block_id":{"type":"string","pattern":"^seed-block:[0-9a-f]{64}$"},"pairing_contract_digest":{"$ref":"#/$defs/digest"}}},"blocks":{"type":"array","minItems":5,"maxItems":5,"items":{"$ref":"#/$defs/block"}},"contract":{"type":"object","additionalProperties":false,"required":["contract_id","pairing_scope","cross_seed_pairing","seeds","subsets","candidate_family_size","block_size","contract_digest"],"properties":{"contract_id":{"const":"h4l-mass-off-within-seed-joint-v1"},"pairing_scope":{"const":"within_seed"},"cross_seed_pairing":{"const":"none"},"seeds":{"const":[42,43,44,45,46]},"subsets":{"type":"array","minItems":16,"maxItems":16,"uniqueItems":true},"candidate_family_size":{"const":80},"block_size":{"const":16},"contract_digest":{"$ref":"#/$defs/digest"}}},"budgets":{"type":"object","required":["mc_bootstrap","toys","t2"],"additionalProperties":false,"properties":{"mc_bootstrap":{"type":"object","const":{"replicas":200,"seed":42001}},"toys":{"type":"object","const":{"injections":[0,1,2],"count":500,"seed":42}},"t2":{"type":"object","const":{"mu":1,"outer_replicas":20,"inner_toys":100,"seed":42}}}}}
}
