{
  "assessment_payload_read": false,
  "blocks": [
    {
      "block_id": "seed-block:6f6ff5c9d7d93f700641d972f41c96367584dcd4d12209c7dedfa076ee89a5d0",
      "candidate_keys": [
        "M0off:42",
        "M3:42:groups=A:m4l=off",
        "M3:42:groups=B:m4l=off",
        "M3:42:groups=C:m4l=off",
        "M3:42:groups=D:m4l=off",
        "M3:42:groups=AB:m4l=off",
        "M3:42:groups=AC:m4l=off",
        "M3:42:groups=AD:m4l=off",
        "M3:42:groups=BC:m4l=off",
        "M3:42:groups=BD:m4l=off",
        "M3:42:groups=CD:m4l=off",
        "M3:42:groups=ABC:m4l=off",
        "M3:42:groups=ABD:m4l=off",
        "M3:42:groups=ACD:m4l=off",
        "M3:42:groups=BCD:m4l=off",
        "M3:42:groups=ABCD:m4l=off"
      ],
      "pairing_contract_digest": "9baedc4c4619894bb29a6ad0628af7d9af06cd2bc67d2783e5d1e9ef27cbc81f",
      "seed": 42
    },
    {
      "block_id": "seed-block:b67e51df6805275aff15c8363eeec595b3dd2ffb55a1973553665cf68bb195d2",
      "candidate_keys": [
        "M0off:43",
        "M3:43:groups=A:m4l=off",
        "M3:43:groups=B:m4l=off",
        "M3:43:groups=C:m4l=off",
        "M3:43:groups=D:m4l=off",
        "M3:43:groups=AB:m4l=off",
        "M3:43:groups=AC:m4l=off",
        "M3:43:groups=AD:m4l=off",
        "M3:43:groups=BC:m4l=off",
        "M3:43:groups=BD:m4l=off",
        "M3:43:groups=CD:m4l=off",
        "M3:43:groups=ABC:m4l=off",
        "M3:43:groups=ABD:m4l=off",
        "M3:43:groups=ACD:m4l=off",
        "M3:43:groups=BCD:m4l=off",
        "M3:43:groups=ABCD:m4l=off"
      ],
      "pairing_contract_digest": "9baedc4c4619894bb29a6ad0628af7d9af06cd2bc67d2783e5d1e9ef27cbc81f",
      "seed": 43
    },
    {
      "block_id": "seed-block:7127e963fadea6d59932f0382dfc3ef2fd44f0bcbb06186d1229dcd5c1e9cc34",
      "candidate_keys": [
        "M0off:44",
        "M3:44:groups=A:m4l=off",
        "M3:44:groups=B:m4l=off",
        "M3:44:groups=C:m4l=off",
        "M3:44:groups=D:m4l=off",
        "M3:44:groups=AB:m4l=off",
        "M3:44:groups=AC:m4l=off",
        "M3:44:groups=AD:m4l=off",
        "M3:44:groups=BC:m4l=off",
        "M3:44:groups=BD:m4l=off",
        "M3:44:groups=CD:m4l=off",
        "M3:44:groups=ABC:m4l=off",
        "M3:44:groups=ABD:m4l=off",
        "M3:44:groups=ACD:m4l=off",
        "M3:44:groups=BCD:m4l=off",
        "M3:44:groups=ABCD:m4l=off"
      ],
      "pairing_contract_digest": "9baedc4c4619894bb29a6ad0628af7d9af06cd2bc67d2783e5d1e9ef27cbc81f",
      "seed": 44
    },
    {
      "block_id": "seed-block:daedc3f0ae81afcfad2009b498800d7c146d9b6d8964458762cbba784da1bc7d",
      "candidate_keys": [
        "M0off:45",
        "M3:45:groups=A:m4l=off",
        "M3:45:groups=B:m4l=off",
        "M3:45:groups=C:m4l=off",
        "M3:45:groups=D:m4l=off",
        "M3:45:groups=AB:m4l=off",
        "M3:45:groups=AC:m4l=off",
        "M3:45:groups=AD:m4l=off",
        "M3:45:groups=BC:m4l=off",
        "M3:45:groups=BD:m4l=off",
        "M3:45:groups=CD:m4l=off",
        "M3:45:groups=ABC:m4l=off",
        "M3:45:groups=ABD:m4l=off",
        "M3:45:groups=ACD:m4l=off",
        "M3:45:groups=BCD:m4l=off",
        "M3:45:groups=ABCD:m4l=off"
      ],
      "pairing_contract_digest": "9baedc4c4619894bb29a6ad0628af7d9af06cd2bc67d2783e5d1e9ef27cbc81f",
      "seed": 45
    },
    {
      "block_id": "seed-block:d3ea41fdbc308220573c679048c0d9ab8a1ffee59d2383a1cc9a009df26846ab",
      "candidate_keys": [
        "M0off:46",
        "M3:46:groups=A:m4l=off",
        "M3:46:groups=B:m4l=off",
        "M3:46:groups=C:m4l=off",
        "M3:46:groups=D:m4l=off",
        "M3:46:groups=AB:m4l=off",
        "M3:46:groups=AC:m4l=off",
        "M3:46:groups=AD:m4l=off",
        "M3:46:groups=BC:m4l=off",
        "M3:46:groups=BD:m4l=off",
        "M3:46:groups=CD:m4l=off",
        "M3:46:groups=ABC:m4l=off",
        "M3:46:groups=ABD:m4l=off",
        "M3:46:groups=ACD:m4l=off",
        "M3:46:groups=BCD:m4l=off",
        "M3:46:groups=ABCD:m4l=off"
      ],
      "pairing_contract_digest": "9baedc4c4619894bb29a6ad0628af7d9af06cd2bc67d2783e5d1e9ef27cbc81f",
      "seed": 46
    }
  ],
  "budgets": {
    "mc_bootstrap": {
      "replicas": 200,
      "seed": 42001
    },
    "t2": {
      "inner_toys": 100,
      "mu": 1,
      "outer_replicas": 20,
      "seed": 42
    },
    "toys": {
      "count": 500,
      "injections": [
        0,
        1,
        2
      ],
      "seed": 42
    }
  },
  "candidate_definition_digest": "aaaaaaaaaaaaaaaaaaaaaaaaaaaaaaaaaaaaaaaaaaaaaaaaaaaaaaaaaaaaaaaa",
  "candidate_keys": [
    "M0off:42",
    "M3:42:groups=A:m4l=off",
    "M3:42:groups=B:m4l=off",
    "M3:42:groups=C:m4l=off",
    "M3:42:groups=D:m4l=off",
    "M3:42:groups=AB:m4l=off",
    "M3:42:groups=AC:m4l=off",
    "M3:42:groups=AD:m4l=off",
    "M3:42:groups=BC:m4l=off",
    "M3:42:groups=BD:m4l=off",
    "M3:42:groups=CD:m4l=off",
    "M3:42:groups=ABC:m4l=off",
    "M3:42:groups=ABD:m4l=off",
    "M3:42:groups=ACD:m4l=off",
    "M3:42:groups=BCD:m4l=off",
    "M3:42:groups=ABCD:m4l=off",
    "M0off:43",
    "M3:43:groups=A:m4l=off",
    "M3:43:groups=B:m4l=off",
    "M3:43:groups=C:m4l=off",
    "M3:43:groups=D:m4l=off",
    "M3:43:groups=AB:m4l=off",
    "M3:43:groups=AC:m4l=off",
    "M3:43:groups=AD:m4l=off",
    "M3:43:groups=BC:m4l=off",
    "M3:43:groups=BD:m4l=off",
    "M3:43:groups=CD:m4l=off",
    "M3:43:groups=ABC:m4l=off",
    "M3:43:groups=ABD:m4l=off",
    "M3:43:groups=ACD:m4l=off",
    "M3:43:groups=BCD:m4l=off",
    "M3:43:groups=ABCD:m4l=off",
    "M0off:44",
    "M3:44:groups=A:m4l=off",
    "M3:44:groups=B:m4l=off",
    "M3:44:groups=C:m4l=off",
    "M3:44:groups=D:m4l=off",
    "M3:44:groups=AB:m4l=off",
    "M3:44:groups=AC:m4l=off",
    "M3:44:groups=AD:m4l=off",
    "M3:44:groups=BC:m4l=off",
    "M3:44:groups=BD:m4l=off",
    "M3:44:groups=CD:m4l=off",
    "M3:44:groups=ABC:m4l=off",
    "M3:44:groups=ABD:m4l=off",
    "M3:44:groups=ACD:m4l=off",
    "M3:44:groups=BCD:m4l=off",
    "M3:44:groups=ABCD:m4l=off",
    "M0off:45",
    "M3:45:groups=A:m4l=off",
    "M3:45:groups=B:m4l=off",
    "M3:45:groups=C:m4l=off",
    "M3:45:groups=D:m4l=off",
    "M3:45:groups=AB:m4l=off",
    "M3:45:groups=AC:m4l=off",
    "M3:45:groups=AD:m4l=off",
    "M3:45:groups=BC:m4l=off",
    "M3:45:groups=BD:m4l=off",
    "M3:45:groups=CD:m4l=off",
    "M3:45:groups=ABC:m4l=off",
    "M3:45:groups=ABD:m4l=off",
    "M3:45:groups=ACD:m4l=off",
    "M3:45:groups=BCD:m4l=off",
    "M3:45:groups=ABCD:m4l=off",
    "M0off:46",
    "M3:46:groups=A:m4l=off",
    "M3:46:groups=B:m4l=off",
    "M3:46:groups=C:m4l=off",
    "M3:46:groups=D:m4l=off",
    "M3:46:groups=AB:m4l=off",
    "M3:46:groups=AC:m4l=off",
    "M3:46:groups=AD:m4l=off",
    "M3:46:groups=BC:m4l=off",
    "M3:46:groups=BD:m4l=off",
    "M3:46:groups=CD:m4l=off",
    "M3:46:groups=ABC:m4l=off",
    "M3:46:groups=ABD:m4l=off",
    "M3:46:groups=ACD:m4l=off",
    "M3:46:groups=BCD:m4l=off",
    "M3:46:groups=ABCD:m4l=off"
  ],
  "evaluation_definition_digest": "aaaaaaaaaaaaaaaaaaaaaaaaaaaaaaaaaaaaaaaaaaaaaaaaaaaaaaaaaaaaaaaa",
  "family_id": "engineered19_raw_T1_m4l_off_attribution_v1",
  "original_definition_digest": "aaaaaaaaaaaaaaaaaaaaaaaaaaaaaaaaaaaaaaaaaaaaaaaaaaaaaaaaaaaaaaaa",
  "pairing_contract": {
    "block_size": 16,
    "candidate_family_size": 80,
    "contract_digest": "9baedc4c4619894bb29a6ad0628af7d9af06cd2bc67d2783e5d1e9ef27cbc81f",
    "contract_id": "h4l-mass-off-within-seed-joint-v1",
    "cross_seed_pairing": "none",
    "pairing_scope": "within_seed",
    "seeds": [
      42,
      43,
      44,
      45,
      46
    ],
    "subsets": [
      "",
      "A",
      "B",
      "C",
      "D",
      "AB",
      "AC",
      "AD",
      "BC",
      "BD",
      "CD",
      "ABC",
      "ABD",
      "ACD",
      "BCD",
      "ABCD"
    ]
  },
  "population_id": "synthetic-example-population",
  "prepared_artifact_id": "aaaaaaaaaaaaaaaaaaaaaaaaaaaaaaaaaaaaaaaaaaaaaaaaaaaaaaaaaaaaaaaa",
  "protocol_sha256": "aaaaaaaaaaaaaaaaaaaaaaaaaaaaaaaaaaaaaaaaaaaaaaaaaaaaaaaaaaaaaaaa",
  "qualification": {
    "scope": "synthetic_example_not_scientific_evidence"
  },
  "registration_id": "aaaaaaaaaaaaaaaaaaaaaaaaaaaaaaaaaaaaaaaaaaaaaaaaaaaaaaaaaaaaaaaa",
  "registration_status": "exploratory_v2",
  "schema_version": "h4l-mass-off-registration-v2",
  "source_history": [],
  "source_registration_id": "aaaaaaaaaaaaaaaaaaaaaaaaaaaaaaaaaaaaaaaaaaaaaaaaaaaaaaaaaaaaaaaa",
  "source_registration_path": "synthetic://source-registration"
}
